{
  "0000": {
    "context": "000BD314",
    "developer_comment": "06/07/2029 19:16",
    "character_limit": 9,
    "string": "2029/06/07 19:16"
  },
  "0001": {
    "context": "000BD2A0",
    "developer_comment": "The day where Watase heard the truth of the Great Rokumei City Arson. He comes to know why the incident occurred...",
    "character_limit": 57,
    "string": "鹿鳴市同時多発火災の真相を聞かされた、あの日。渡瀬はその元凶が、何であったかを知る事となった……。"
  },
  "0002": {
    "context": "000BD28C",
    "developer_comment": "06/07/2029 19:28",
    "character_limit": 9,
    "string": "2029/06/07 19:28"
  },
  "0003": {
    "context": "000BD230",
    "developer_comment": "And so Watase asks: what happened to Rokumei City and LABO after Communicator A's death...?",
    "character_limit": 45,
    "string": "そして渡瀬は問いかけた。コミュニケーターＡの死後、鹿鳴市とラボがいったい何をしたのかを……。"
  },
  "0004": {
    "context": "000BD218",
    "developer_comment": "07/07/2029 17:35",
    "character_limit": 11,
    "string": "2029/07/07 17:35"
  },
  "0005": {
    "context": "000BD1A0",
    "developer_comment": "The day Watase decided to join Q. To understand Ukita's intentions, Watase asks why the researcher would betray LABO...",
    "character_limit": 59,
    "string": "Ｑに入る事を決めた、その日。渡瀬は納得できる理由を求め、宇喜多に『ラボを裏切る動機』を尋ねていた……。"
  },
  "0006": {
    "context": "000BD18C",
    "developer_comment": "07/07/2029 20:21",
    "character_limit": 9,
    "string": "2029/07/07 20:21"
  },
  "0007": {
    "context": "000BD118",
    "developer_comment": "The day they started cooking up the terrorist plot. Ukita tells Watase what Q's objective is for the first time...",
    "character_limit": 57,
    "string": "テロ計画を練り始めた日の事。渡瀬は宇喜多から、初めてＱの目的が何であるかを明かされた……。"
  },
  "0008": {
    "context": "000BD104",
    "developer_comment": "09/16/2030 07:50",
    "character_limit": 9,
    "string": "2030/09/16 07:50"
  },
  "0009": {
    "context": "000BD0A8",
    "developer_comment": "A few hours ago. Watase plans to gun down the inhuman monsters known as Communicators...",
    "character_limit": 45,
    "string": "数時間前。渡瀬は銃で撃ち殺すつもりでいた。コミュニケーターという人外の怪物を……。"
  },
  "0010": {
    "context": "000BD094",
    "developer_comment": "09/16/2030 10:11",
    "character_limit": 9,
    "string": "2030/09/16 10:11"
  },
  "0011": {
    "context": "000BD038",
    "developer_comment": "When he discovers the room with three corpses, Ukita's doubts surrounding Watase explode...",
    "character_limit": 45,
    "string": "その部屋で３人の死体を見つけた時、宇喜多の中にあった渡瀬への疑心は爆発した……。"
  },
  "0012": {
    "context": "000BD020",
    "developer_comment": "09/16/2030 11:17",
    "character_limit": 11,
    "string": "2030/09/16 11:17"
  },
  "0013": {
    "context": "000BCF98",
    "developer_comment": "As he goes with Watase towards the sprinkler system, Ukita subtly tries to confirm whether or not Watase really lost his memories...",
    "character_limit": 67,
    "string": "渡瀬と共に消火システムの下へ向かいながら、宇喜多はさりげなく、渡瀬が本当に記憶喪失なのか確認しようとした……。"
  },
  "0014": {
    "context": "000BCF80",
    "developer_comment": "09/16/2030 11:47",
    "character_limit": 11,
    "string": "2030/09/16 11:47"
  },
  "0015": {
    "context": "000BCF18",
    "developer_comment": "Right when he sees Ena starting up computers in LABO, Dr. Tenkawa's words echo through Ukita's head...",
    "character_limit": 51,
    "string": "ラボのパソコンを起動させている恵那を見た瞬間、宇喜多の脳裏に甦ったのは、天川博士が言ったある言葉だった……。"
  },
  "0016": {
    "context": "000BCF00",
    "developer_comment": "09/16/2030 12:15",
    "character_limit": 11,
    "string": "2030/09/16 12:15"
  },
  "0017": {
    "context": "000BCEC8",
    "developer_comment": "It was then that Ukita encountered Subject N's body...",
    "character_limit": 27,
    "string": "その時、宇喜多は被験体Ｎの死体と遭遇した……。"
  },
  "0018": {
    "context": "000BCE90",
    "developer_comment": "It was then that Ukita discovered Subject N's body...",
    "character_limit": 27,
    "string": "その時、宇喜多は少女の死体を発見した……。"
  },
  "0019": {
    "context": "000BCE7C",
    "developer_comment": "09/16/2030 09:30",
    "character_limit": 9,
    "string": "2030/09/16 09:30"
  },
  "0020": {
    "context": "000BCDF0",
    "developer_comment": "An amnesiac captain and an acidic teacher. All the adults Jun encounter in this extreme situation are ones with those negative traits...",
    "character_limit": 69,
    "string": "記憶喪失の隊長と、ひどい剣幕でわめく女教師。極限状況の中で洵が遭遇した大人たちは、一癖ある者ばかりだった……。"
  },
  "0021": {
    "context": "000BCDD8",
    "developer_comment": "09/16/2030 09:54",
    "character_limit": 11,
    "string": "2030/09/16 09:54"
  },
  "0022": {
    "context": "000BCD70",
    "developer_comment": "A hallway shrouded in smoke. Jun decides to pull back at the sight, but Ena flares up at her again...",
    "character_limit": 51,
    "string": "通路に立ちこめる煙。それを見て洵が引き返そうと判断した時、また恵那が食ってかかってきた……。"
  },
  "0023": {
    "context": "000BCD58",
    "developer_comment": "09/16/2030 10:13",
    "character_limit": 11,
    "string": "2030/09/16 10:13"
  },
  "0024": {
    "context": "000BCCD0",
    "developer_comment": "Though Jun found Dojima's body, there was no time to grieve. But after overcoming many hardships, she finally gets a moment to rest...",
    "character_limit": 67,
    "string": "堂島の死に遭遇しても、悲しんでいる暇はなかった。だが幾多の困難を乗り越えて、洵は束の間の休息を手に入れた……。"
  },
  "0025": {
    "context": "000BCCB8",
    "developer_comment": "09/16/2030 11:31",
    "character_limit": 11,
    "string": "2030/09/16 11:31"
  },
  "0026": {
    "context": "000BCC38",
    "developer_comment": "Hiyama's body showed up as if to crush their hopes. Jun is heartbroken, but finds an unexpected someone giving her strength...",
    "character_limit": 63,
    "string": "希望を踏みにじるように現れた、桧山の死体。そのとき心が折れかけた洵に、力を与えてくれたのは……。"
  },
  "0027": {
    "context": "000BCBD0",
    "developer_comment": "After passing many trials to make it to that room, Jun discovers the body of a mysterious girl...",
    "character_limit": 51,
    "string": "幾多の苦難を乗り越えて辿り着いたその部屋で、洵は見知らぬ少女の死体を発見した……。"
  },
  "0028": {
    "context": "000BCB94",
    "developer_comment": "Jun discovers the body of a mysterious girl in that room...",
    "character_limit": 29,
    "string": "洵はその部屋で、見知らぬ少女の死体を発見した……。"
  },
  "0029": {
    "context": "000BCB80",
    "developer_comment": "09/16/2030 09:20",
    "character_limit": 9,
    "string": "2030/09/16 09:20"
  },
  "0030": {
    "context": "000BCAF8",
    "developer_comment": "Kazami reunited with Watase, only to find he'd lost his memory. She decides to harden her heart to get out of this situation alive...",
    "character_limit": 67,
    "string": "ラボの中で再会した渡瀬は、全ての記憶を失っていた。風見はこの現場を生き延びるため、厳しくなろうと心に決めた……。"
  },
  "0031": {
    "context": "000BCA78",
    "developer_comment": "In the midst of their already unfavorable situation, the corpses of two of Kazami's rescue squad coworkers lie in wait...",
    "character_limit": 63,
    "string": "まったく好転しない状況の中、風見たちを待ち受けていたのは、除救助者２名と仲間の亡骸だった……。"
  },
  "0032": {
    "context": "000BCA00",
    "developer_comment": "Hiyama's body is found just an hour after Dojima's. Kazami tries to hide her distress behind a mask of bravery, but...",
    "character_limit": 59,
    "string": "堂島の死体発見から１時間後、今度は桧山の死体が見つかる。動揺を抑え、毅然とした態度を貫こうとする風見だったが……。"
  },
  "0033": {
    "context": "000BC9CC",
    "developer_comment": "And then Kazami discovered Subject N's body...",
    "character_limit": 25,
    "string": "そして風見は、被験体Ｎの死体を発見した……。"
  },
  "0034": {
    "context": "000BC9B8",
    "developer_comment": "04/15/2026 08:23",
    "character_limit": 9,
    "string": "2026/04/15 08:23"
  },
  "0035": {
    "context": "000BC950",
    "developer_comment": "Four years ago. Ukita achieves his longtime dream of being employed in LABO, and meets Dr. Tenkawa...",
    "character_limit": 51,
    "string": "４年前。宇喜多は念願だったラボへの入所を果たし、そこで天川博士と出会っていた……。"
  },
  "0036": {
    "context": "000BC93C",
    "developer_comment": "04/20/2028 13:27",
    "character_limit": 9,
    "string": "2028/04/20 13:27"
  },
  "0037": {
    "context": "000BC8D8",
    "developer_comment": "Two years ago. Dr. Tenkawa entrusts Ukita with a certain job. He willingly accepts it, and then...",
    "character_limit": 49,
    "string": "２年前。宇喜多は天川博士から、とある仕事を頼まれた。そして、それを快く承諾した宇喜多だったが……。"
  },
  "0038": {
    "context": "000BC8C0",
    "developer_comment": "07/21/2028 16:22",
    "character_limit": 11,
    "string": "2028/07/21 16:22"
  },
  "0039": {
    "context": "000BC850",
    "developer_comment": "Ukita's lonely battle began from the night he discovered the truth about LABO. Then one day, his phone rings...",
    "character_limit": 55,
    "string": "ラボの真実を知ったあの夜から、宇喜多の孤独な戦いが始まった。そんなある日、宇喜多の電話が鳴り響き……。"
  },
  "0040": {
    "context": "000BC838",
    "developer_comment": "07/07/2029 23:18",
    "character_limit": 11,
    "string": "2029/07/07 23:18"
  },
  "0041": {
    "context": "000BC7B8",
    "developer_comment": "Ukita and his new ally steadily prepared for the terrorist plot. But the security department then turns their eyes on Ukita...",
    "character_limit": 63,
    "string": "信頼できる仲間を得て、着々とテロの準備を進める宇喜多。だがそんな宇喜多に、保安課の目が向き始め……。"
  },
  "0042": {
    "context": "000BC7A4",
    "developer_comment": "09/16/2030 05:30",
    "character_limit": 9,
    "string": "2030/09/16 05:30"
  },
  "0043": {
    "context": "000BC710",
    "developer_comment": "D-day then arrived. The plan looked like it was going off without a hitch. But what Ukita finds waiting for him is his comrades' harsh betrayal...",
    "character_limit": 73,
    "string": "そして運命の日。計画は順調に進んでいるかに思われた。だが宇喜多に待っていたのは、仲間の手酷い裏切りだった……。"
  },
  "0044": {
    "context": "000BC6F8",
    "developer_comment": "07/01/2028 21:43",
    "character_limit": 11,
    "string": "2028/07/01 21:43"
  },
  "0045": {
    "context": "000BC670",
    "developer_comment": "Back when Ukita was still observing Natsuhiko. He has a conversation with Dr. Tenkawa about the past and future of the Communicators...",
    "character_limit": 67,
    "string": "まだ夏彦の監視任務に就いていた頃。宇喜多はある日天川博士と、コミュニケーターの過去と未来について話し合った……。"
  },
  "0046": {
    "context": "000BC65C",
    "developer_comment": "08/15/2028 20:39",
    "character_limit": 9,
    "string": "2028/08/15 20:39"
  },
  "0047": {
    "context": "000BC600",
    "developer_comment": "The day Ukita became a Q member. Ukita asks the other Q member about the history of Q...",
    "character_limit": 45,
    "string": "Ｑのメンバーとなったある日。宇喜多はＱの人間に、Ｑの歴史について尋ねていた……。"
  },
  "0048": {
    "context": "000BC5EC",
    "developer_comment": "07/07/2021 13:31",
    "character_limit": 9,
    "string": "2021/07/07 13:31"
  },
  "0049": {
    "context": "000BC588",
    "developer_comment": "Nine years ago. Mashiro gets into an argument with Natsuhiko when he insists on going to LABO...",
    "character_limit": 49,
    "string": "９年前。ラボに行くと言って聞かない夏彦と、ましろは口論になっていた……。"
  },
  "0050": {
    "context": "000BC574",
    "developer_comment": "07/16/2021 14:43",
    "character_limit": 9,
    "string": "2021/07/16 14:43"
  },
  "0051": {
    "context": "000BC500",
    "developer_comment": "One week after Yuuri's funeral. Mashiro visits Natsuhiko in the hospital, only to find him in a shocking state...",
    "character_limit": 57,
    "string": "悠里の葬儀から、１週間が過ぎた頃。夏彦のお見舞いに行ったましろが見たのは、変わり果てた夏彦の姿だった……。"
  },
  "0052": {
    "context": "000BC4E8",
    "developer_comment": "07/23/2021 15:30",
    "character_limit": 11,
    "string": "2021/07/23 15:30"
  },
  "0053": {
    "context": "000BC468",
    "developer_comment": "Three months passed after Natsuhiko's coma began. The day Mashiro had awaited finally arrives: Natsuhiko's day of awakening...",
    "character_limit": 63,
    "string": "夏彦が目覚めないまま、３ヶ月が過ぎたある日。その日を待ち望んでいたましろの前で、夏彦はついに目覚めていた……。"
  },
  "0054": {
    "context": "000BC450",
    "developer_comment": "09/10/2030 06:19",
    "character_limit": 11,
    "string": "2030/09/10 06:19"
  },
  "0055": {
    "context": "000BC3D8",
    "developer_comment": "Nine years after the incident at LABO. Natsuhiko averts his eyes from reality. Mashiro keeps telling him white lies...",
    "character_limit": 59,
    "string": "ラボの事故から９年。あの日以来ずっと現実から目をそらし続けている夏彦に、ましろは優しい嘘をつき続けていた……。"
  },
  "0056": {
    "context": "000BC3C4",
    "developer_comment": "09/11/2030 16:47",
    "character_limit": 9,
    "string": "2030/09/11 16:47"
  },
  "0057": {
    "context": "000BC350",
    "developer_comment": "Mashiro is fine with Natsuhiko as he is. But a visit to the park serves as a bitter reminder of Mashiro's past...",
    "character_limit": 57,
    "string": "今の夏彦に不満はなかった。だがふと立ち寄った公園で、ましろは昔を思い出し、どうしようもなく切なくなった……。"
  },
  "0058": {
    "context": "000BC33C",
    "developer_comment": "06/01/2020 13:15",
    "character_limit": 9,
    "string": "2020/06/01 13:15"
  },
  "0059": {
    "context": "000BC2C0",
    "developer_comment": "Before becoming his friend, Mashiro hears a rumor about Natsuhiko getting a girlfriend. Mashiro goes to meet this girl...",
    "character_limit": 61,
    "string": "まだ夏彦と仲良くなる前の記憶。夏彦に恋人ができたという噂を聞いたましろは、その女の子に会いに行く事にした……。"
  },
  "0060": {
    "context": "000BC2A8",
    "developer_comment": "08/10/2020 15:20",
    "character_limit": 11,
    "string": "2020/08/10 15:20"
  },
  "0061": {
    "context": "000BC230",
    "developer_comment": "Yuuri, Natsuhiko, and Mashiro became friends. They test their courage at a ruined building on the outskirts of town...",
    "character_limit": 59,
    "string": "夏彦とましろが仲良くなり、悠里も一緒に遊ぶようになったある日。３人は、街外れの廃墟に肝試しに来ていた……。"
  },
  "0062": {
    "context": "000BC218",
    "developer_comment": "09/13/2030 18:55",
    "character_limit": 11,
    "string": "2030/09/13 18:55"
  },
  "0063": {
    "context": "000BC188",
    "developer_comment": "After Natsuhiko heard Mashiro's story about the terrorist but refused to take her seriously. Mashiro begins to look for the terrorist alone...",
    "character_limit": 71,
    "string": "テロリストの話をしても、夏彦が取り合ってくれなかった後の事。ましろは１人で、テロリストの捜索を開始した……。"
  },
  "0064": {
    "context": "000BC174",
    "developer_comment": "09/16/2030 17:42",
    "character_limit": 9,
    "string": "2030/09/16 17:42"
  },
  "0065": {
    "context": "000BC100",
    "developer_comment": "A memory of not too long ago. A thought coiled itself in Mashiro's mind ever since she learned Yuuri was alive...",
    "character_limit": 57,
    "string": "つい先ほどの記憶。悠里が生きてると知ってから、ましろの中にはずっとわだかまっている思いがあった……。"
  },
  "0066": {
    "context": "000BC0E8",
    "developer_comment": "09/11/2030 20:07",
    "character_limit": 11,
    "string": "2030/09/11 20:07"
  },
  "0067": {
    "context": "000BC068",
    "developer_comment": "Right after Salyu moves in, Dr. Tenkawa secretly explains the details to Mashiro. Mashiro confesses her concealed feelings...",
    "character_limit": 63,
    "string": "サリュが天川家にやってきた、あの夜。密かに事情を話しに現れた天川博士に、ましろはある想いを打ち明けていた……。"
  },
  "0068": {
    "context": "000BC054",
    "developer_comment": "04/04/2014 13:28",
    "character_limit": 9,
    "string": "2014/04/04 13:28"
  },
  "0069": {
    "context": "000BBFE8",
    "developer_comment": "Sixteen years ago, when Ena was still eight. Her beloved father worked at a certain research facility...",
    "character_limit": 53,
    "string": "１６年前。恵那がまだ８歳だった頃。大好きだった恵那の父は、とある研究施設で働いていた……。"
  },
  "0070": {
    "context": "000BBFD4",
    "developer_comment": "04/05/2028 07:50",
    "character_limit": 9,
    "string": "2028/04/05 07:50"
  },
  "0071": {
    "context": "000BBF48",
    "developer_comment": "With her dear father gone, Ena followed in his footsteps. And so, 13 years later, she finds employment in the same place as her father...",
    "character_limit": 69,
    "string": "最愛の父を失った恵那は、亡き父の足跡を追い続けた。そして１３年後、父と同じ職場に入局した……。"
  },
  "0072": {
    "context": "000BBF34",
    "developer_comment": "04/08/2030 07:31",
    "character_limit": 9,
    "string": "2030/04/08 07:31"
  },
  "0073": {
    "context": "000BBEC8",
    "developer_comment": "After two years as a Communicator commissioner, Ena is tasked with being a teacher at Rokumei Academy...",
    "character_limit": 53,
    "string": "コミュニケーター管理官として２年を過ごしたある日。恵那に与えられた任務は、鹿鳴学園の教師になる事だった……。"
  },
  "0074": {
    "context": "000BBEB0",
    "developer_comment": "06/16/2030 16:21",
    "character_limit": 11,
    "string": "2030/06/16 16:21"
  },
  "0075": {
    "context": "000BBE38",
    "developer_comment": "Ena led a double life as teacher and commissioner. Doubting LABO, she requests her group conduct a secret inspection...",
    "character_limit": 59,
    "string": "教師と管理官の２重生活を続ける中で、恵那はラボに対するある疑惑を深めて行き、ついに上司に潜入調査を進言した……。"
  },
  "0076": {
    "context": "000BBE20",
    "developer_comment": "09/16/2030 05:56",
    "character_limit": 11,
    "string": "2030/09/16 05:56"
  },
  "0077": {
    "context": "000BBD98",
    "developer_comment": "D-day arrives. Ena and her two superiors infiltrate LABO. But what lies in wait there is a nightmare far beyond their imaginations...",
    "character_limit": 67,
    "string": "そして運命の日。恵那は２人の上司と共にラボに潜入した。だがそこに待ち構えたのは、想像を絶する悪夢だった……。"
  },
  "0078": {
    "context": "000BBD84",
    "developer_comment": "04/15/2030 17:15",
    "character_limit": 9,
    "string": "2030/04/15 17:15"
  },
  "0079": {
    "context": "000BBD10",
    "developer_comment": "As a Communicator commissioner, Ena secretly meets Dr. Tenkawa and tries to ask her about her true intentions...",
    "character_limit": 57,
    "string": "天川博士と密会した時の記憶。恵那はコミュニケーター管理官として、天川博士の真意を聞き出そうと試みた……。"
  },
  "0080": {
    "context": "000BBCF8",
    "developer_comment": "09/15/2030 09:56",
    "character_limit": 11,
    "string": "2030/09/15 09:56"
  },
  "0081": {
    "context": "000BBC78",
    "developer_comment": "Ena thinks to herself on her last day as a teacher. When Natsuhiko, Mashiro, and Salyu arrive, Ena begins her final lesson...",
    "character_limit": 63,
    "string": "教師として過ごす最後の日。恵那の中に様々な思いが去来する。そして夏彦たちが訪れ、恵那の最後の授業が始まった……。"
  },
  "0082": {
    "context": "000BBC64",
    "developer_comment": "09/16/2030 13:20",
    "character_limit": 9,
    "string": "2030/09/16 13:20"
  },
  "0083": {
    "context": "000BBBF0",
    "developer_comment": "Is Captain Kasasagi a terrorist? Every time that doubt plays in Ena's head, anxiety continues to sway her heart...",
    "character_limit": 57,
    "string": "隊長さんはテロリストなのかしら？　その疑いが脳裏をよぎるたび、恵那の心は不安定に揺らめき続けていた……。"
  },
  "0084": {
    "context": "000BBBD8",
    "developer_comment": "09/16/2030 10:41",
    "character_limit": 11,
    "string": "2030/09/16 10:41"
  },
  "0085": {
    "context": "000BBB70",
    "developer_comment": "As Ena carries an unconscious Watase out of a contaminated zone, she remembers a dog she once owned...",
    "character_limit": 51,
    "string": "汚染区域から渡瀬が気絶して戻った時――恵那は渡瀬を抱えて歩きながら、昔飼っていた犬の事を思い出していた……。"
  },
  "0086": {
    "context": "000BBB58",
    "developer_comment": "09/01/2027 10:00",
    "character_limit": 11,
    "string": "2027/09/01 10:00"
  },
  "0087": {
    "context": "000BBB08",
    "developer_comment": "Salyu was in a cold, jail-like room. But that facility was her entire world...",
    "character_limit": 39,
    "string": "サリュはまるで牢屋のような無機質な部屋にいた。そしてその施設の中こそが、サリュの世界の全てだった……。"
  },
  "0088": {
    "context": "000BBAF0",
    "developer_comment": "09/22/2027 17:14",
    "character_limit": 11,
    "string": "2027/09/22 17:14"
  },
  "0089": {
    "context": "000BBA88",
    "developer_comment": "Salyu's days without freedom went on and on. Then one day, she asks Dr. Tenkawa about her own birth...",
    "character_limit": 51,
    "string": "自由のない日々を送るサリュ。そんなある日、サリュは天川博士の自分の出生について質問した……。"
  },
  "0090": {
    "context": "000BBA70",
    "developer_comment": "10/01/2027 14:06",
    "character_limit": 11,
    "string": "2027/10/01 14:06"
  },
  "0091": {
    "context": "000BBA10",
    "developer_comment": "--The end comes suddenly. One day, Salyu suddenly loses the sole meaning of her existence...",
    "character_limit": 47,
    "string": "――終わりは突然やってきた。サリュはその日、自分にあった唯一の存在意義を失った……。"
  },
  "0092": {
    "context": "000BB9FC",
    "developer_comment": "09/09/2030 21:34",
    "character_limit": 9,
    "string": "2030/09/09 21:34"
  },
  "0093": {
    "context": "000BB990",
    "developer_comment": "Dr. Tenkawa asks Salyu if she wants to be free. It is then that Salyu first realizes her true feelings...",
    "character_limit": 53,
    "string": "サリュは天川博士に『自由になりたい？』と問いかけられた。そのときサリュは初めて、自分の本心に気付かされた……。"
  },
  "0094": {
    "context": "000BB978",
    "developer_comment": "09/10/2030 16:30",
    "character_limit": 11,
    "string": "2030/09/10 16:30"
  },
  "0095": {
    "context": "000BB918",
    "developer_comment": "Salyu loses her \"past\". In exchange, she gains \"the outside world\", \"a partner\" and \"a role\"...",
    "character_limit": 47,
    "string": "サリュは『過去の日々』を失った。代わりに『外の世界』と『相棒』と、そして『役目』を手に入れた……。"
  },
  "0096": {
    "context": "000BB900",
    "developer_comment": "09/11/2030 08:15",
    "character_limit": 11,
    "string": "2030/09/11 08:15"
  },
  "0097": {
    "context": "000BB880",
    "developer_comment": "Salyu found herself in a world with endless surprises. But she eventually finds herself enjoying such a world for what it is...",
    "character_limit": 63,
    "string": "そこは戸惑いの種が尽きる事のない世界だった。でもサリュはいつしかそれさえも、楽しんでいる自分に気付いていた……。"
  },
  "0098": {
    "context": "000BB86C",
    "developer_comment": "09/16/2030 06:19",
    "character_limit": 9,
    "string": "2030/09/16 06:19"
  },
  "0099": {
    "context": "000BB7E8",
    "developer_comment": "The fateful day. After Salyu gets separated from Natsuhiko and Mashiro, she begins her solitary battle to save her dear friends...",
    "character_limit": 65,
    "string": "そして運命の日。夏彦たちと分断されたサリュは、大切な人たちを救うため、たった１人の戦いを開始した……。"
  },
  "0100": {
    "context": "000BB7D0",
    "developer_comment": "07/20/2026 21:31",
    "character_limit": 11,
    "string": "2026/07/20 21:31"
  },
  "0101": {
    "context": "000BB748",
    "developer_comment": "A memory of when Salyu was nine years old. She finds a deep interest in the moving stars and the many stories revolving around them...",
    "character_limit": 67,
    "string": "９歳の頃――。サリュが最も興味を抱いたのは、空を移ろう星々と、その間に生まれる様々な物語だった……。"
  },
  "0102": {
    "context": "000BB730",
    "developer_comment": "09/14/2030 15:48",
    "character_limit": 11,
    "string": "2030/09/14 15:48"
  },
  "0103": {
    "context": "000BB6B8",
    "developer_comment": "Back at the abandoned hospital, when Mashiro revealed she could use empathy. Salyu ponders about Alice and Mashiro...",
    "character_limit": 59,
    "string": "廃病院で、ましろがエンパシーを使えるとわかった時の事。サリュは、アリスとましろについて考えた……。"
  },
  "0104": {
    "context": "000BB6A4",
    "developer_comment": "09/16/2030 15:11",
    "character_limit": 9,
    "string": "2030/09/16 15:11"
  },
  "0105": {
    "context": "000BB620",
    "developer_comment": "Kazami shook Salyu off, knocking her out at the bottom of the stairs. Salyu then dreams of an unknown day in the far off past...",
    "character_limit": 65,
    "string": "風見に振り落とされて、階段で気絶していた時。サリュはいつとも知れない、遠い昔の夢を見た……。"
  },
  "0106": {
    "context": "000BB60C",
    "developer_comment": "09/16/2030 17:04",
    "character_limit": 9,
    "string": "2030/09/16 17:04"
  },
  "0107": {
    "context": "000BB588",
    "developer_comment": "An hour ago. As she worries over Natsuhiko and the others' safety, Salyu finds herself thinking about Natsuhiko for some reason...",
    "character_limit": 65,
    "string": "１時間ほど前。夏彦たちの身を案じたサリュが思い出したのは、なぜか夏彦との思い出だった……。"
  },
  "0108": {
    "context": "000BB574",
    "developer_comment": "09/14/2030 23:24",
    "character_limit": 9,
    "string": "2030/09/14 23:24"
  },
  "0109": {
    "context": "000BB4F8",
    "developer_comment": "Salyu has a conversation with Mashiro in the karaoke box and comes to learn that everyone has their mysteries about them...",
    "character_limit": 61,
    "string": "カラオケボックスでの記憶。サリュはましろとの会話の中で、人は誰もが解けない謎を抱えているのだと理解した……。"
  },
  "0110": {
    "context": "000BB4E0",
    "developer_comment": "06/01/2014 11:31",
    "character_limit": 11,
    "string": "2014/06/01 11:31"
  },
  "0111": {
    "context": "000BB480",
    "developer_comment": "Sixteen years ago, 16-year-old Watase was relaxing in his room when he heard a girl's voice...",
    "character_limit": 47,
    "string": "１６年前。渡瀬が１６歳だった頃。渡瀬が自室で、穏やかな時間を過ごしていると、そこに彼女の声が聞こえてきた……。"
  },
  "0112": {
    "context": "000BB468",
    "developer_comment": "09/07/2014 16:43",
    "character_limit": 11,
    "string": "2014/09/07 16:43"
  },
  "0113": {
    "context": "000BB3E8",
    "developer_comment": "Watase trained his endurance alongside Wataru to fulfill her dream. Along the way, they discuss the Communicator situation...",
    "character_limit": 63,
    "string": "亘の夢を聞いた渡瀬は、彼女と共に体力作りに励む。その合間に渡瀬たちは、コミュニケーターについて意見を交わした……。"
  },
  "0114": {
    "context": "000BB3D0",
    "developer_comment": "09/08/2014 17:02",
    "character_limit": 11,
    "string": "2014/09/08 17:02"
  },
  "0115": {
    "context": "000BB350",
    "developer_comment": "Watase was hospitalized with a broken leg. But one night, something happens that would decisively change his fate forever...",
    "character_limit": 63,
    "string": "足を骨折した渡瀬は病院に入院していた。だがそんなある夜、渡瀬の運命を決定的に変える出来事が起きた……。"
  },
  "0116": {
    "context": "000BB338",
    "developer_comment": "04/07/2021 13:55",
    "character_limit": 11,
    "string": "2021/04/07 13:55"
  },
  "0117": {
    "context": "000BB2B8",
    "developer_comment": "Nine years ago, seven years after Wataru's death. A dispatch sends Watase, now a rescue worker, to a certain disaster site...",
    "character_limit": 63,
    "string": "９年前。亘の死の７年後。レスキュー隊員となった渡瀬は、ある事故現場に出場した……。"
  },
  "0118": {
    "context": "000BB2A0",
    "developer_comment": "06/07/2029 18:26",
    "character_limit": 11,
    "string": "2029/06/07 18:26"
  },
  "0119": {
    "context": "000BB228",
    "developer_comment": "One year ago. Watase's satisfying life changes forever when he receives a phone call that turns his life upside-down...",
    "character_limit": 59,
    "string": "そして１年前。充実した日々を過ごしていた渡瀬にかかってきた電話は、渡瀬の人生を揺るがすものだった……。"
  },
  "0120": {
    "context": "000BB1A0",
    "developer_comment": "After a month of consideration, Watase resolves himself to join Ukita. From that day onwards, they begin planning their attack...",
    "character_limit": 67,
    "string": "１ヶ月悩んだ末に、渡瀬は宇喜多の同志となる決意を固めた。そしてその日から、渡瀬たちの計画は動き始めた……。"
  },
  "0121": {
    "context": "000BB18C",
    "developer_comment": "09/13/2030 15:38",
    "character_limit": 9,
    "string": "2030/09/13 15:38"
  },
  "0122": {
    "context": "000BB118",
    "developer_comment": "With three days to go until they launch their terrorist plot, Watase spends his last day off as a rescue worker...",
    "character_limit": 57,
    "string": "テロ決行を３日後に控えた、その日。渡瀬はレスキュー隊員として迎える、最後の休日を過ごしていた……。"
  },
  "0123": {
    "context": "000BB0B0",
    "developer_comment": "D-day at last. Watase and his comrades headed to the deepest level of LABO, only to find a lone girl...",
    "character_limit": 51,
    "string": "そして運命の日。渡瀬は仲間と共にラボの最深部へ侵入し、そこで１人の少女と接触した……。"
  },
  "0124": {
    "context": "000BB09C",
    "developer_comment": "09/16/2030 07:15",
    "character_limit": 9,
    "string": "2030/09/16 07:15"
  },
  "0125": {
    "context": "000BB030",
    "developer_comment": "Right after the Procyon's warning alarm goes off in Area N, something pierces its way into Watase's head...",
    "character_limit": 53,
    "string": "Ｎエリアでプロキオンが警告音を鳴り響かせた時、渡瀬の頭の中を何かが突き抜けていた……。"
  },
  "0126": {
    "context": "000BB01C",
    "developer_comment": "04/01/2027 16:45",
    "character_limit": 9,
    "string": "2027/04/01 16:45"
  },
  "0127": {
    "context": "000BAFA8",
    "developer_comment": "Three years ago, in front of the fire station. Watase encounters the older sister of the girl he couldn't save...",
    "character_limit": 57,
    "string": "３年前のある日。渡瀬が鹿鳴市消防署前で出会ったのは、かつて自分たちが救えなかった少女の姉だった……。"
  },
  "0128": {
    "context": "000BAF94",
    "developer_comment": "07/07/2027 19:05",
    "character_limit": 9,
    "string": "2027/07/07 19:05"
  },
  "0129": {
    "context": "000BAF10",
    "developer_comment": "Around the time Kazami began to call Watase \"Captain\", the two happened to come across each other at the bus station after work...",
    "character_limit": 65,
    "string": "風見から『隊長』と呼ばれるようになった頃の事。渡瀬は仕事帰りにバス停で、たまたま風見と一緒になっていた……。"
  },
  "0130": {
    "context": "000BAEF8",
    "developer_comment": "08/25/2027 15:42",
    "character_limit": 11,
    "string": "2027/08/25 15:42"
  },
  "0131": {
    "context": "000BAE80",
    "developer_comment": "Kazami started acting weird a day after a harsh scolding from Watase. At first, Watase believed she hated him, but...",
    "character_limit": 59,
    "string": "渡瀬が強く叱責した翌日から、風見の様子はおかしくなった。初めは嫌われたのかと思っていた渡瀬だったが……。"
  },
  "0132": {
    "context": "000BAE68",
    "developer_comment": "10/06/2027 14:00",
    "character_limit": 11,
    "string": "2027/10/06 14:00"
  },
  "0133": {
    "context": "000BADF8",
    "developer_comment": "Watase started going out with Kazami. When she confesses to him about the anxiety she feels, his response is...",
    "character_limit": 55,
    "string": "風見と付き合い始めた渡瀬。己の抱えている不安を口にした風見に、渡瀬が告げたのは……。"
  },
  "0134": {
    "context": "000BADE4",
    "developer_comment": "10/06/2027 23:59",
    "character_limit": 9,
    "string": "2027/10/06 23:59"
  },
  "0135": {
    "context": "000BADBC",
    "developer_comment": "A memory of some night in the past...",
    "character_limit": 19,
    "string": "いつとも知れない、夜の記憶……。"
  },
  "0136": {
    "context": "000BADA8",
    "developer_comment": "09/16/2029 01:16",
    "character_limit": 9,
    "string": "2029/09/16 01:16"
  },
  "0137": {
    "context": "000BAD38",
    "developer_comment": "One night a year ago, Watase realized that to continue being a terrorist, he must give up his days of joy...",
    "character_limit": 55,
    "string": "１年前の、ある夜の事。テロリストとして活動を続けていた渡瀬は、幸せだった日々に別れを告げた……。"
  },
  "0138": {
    "context": "000BAD20",
    "developer_comment": "03/30/2021 10:51",
    "character_limit": 11,
    "string": "2021/03/30 10:51"
  },
  "0139": {
    "context": "000BACA0",
    "developer_comment": "Nine years ago. Kazami was 19. Though her parents were gone, she lived her days happily together with her dear sister Nagisa...",
    "character_limit": 63,
    "string": "９年前。風見が１９歳だった頃。彼女は両親を亡くしても、妹の凪沙と２人仲良く、平穏な日々を過ごしていた……。"
  },
  "0140": {
    "context": "000BAC8C",
    "developer_comment": "04/07/2021 16:11",
    "character_limit": 9,
    "string": "2021/04/07 16:11"
  },
  "0141": {
    "context": "000BAC10",
    "developer_comment": "The day before Nagisa was set to enroll in elementary school. On the way home, Kazami spots a truly unbelievable sight...",
    "character_limit": 61,
    "string": "凪沙の小学校入学を翌日に控えた――その日。家に帰った風見が目にしたのは、信じたくもない光景だった……。"
  },
  "0142": {
    "context": "000BABFC",
    "developer_comment": "04/01/2027 14:15",
    "character_limit": 9,
    "string": "2027/04/01 14:15"
  },
  "0143": {
    "context": "000BAB80",
    "developer_comment": "Kazami became a rescue worker after four years of firefighting. She visits her future workplace, reuniting with \"him\"...",
    "character_limit": 61,
    "string": "消防士になってから、４年目の春。ついにレスキュー隊員となった風見は、その配属先で、彼と再会した……。"
  },
  "0144": {
    "context": "000BAB08",
    "developer_comment": "Kazami's days as a rescue worker flew by. Then came the fateful day. Kazami and her squadmates hurry over to LABO...",
    "character_limit": 59,
    "string": "レスキュー隊員としての日々は、飛ぶように過ぎて行った。そして運命の日。風見は仲間たちと共に、ラボへ急行した……。"
  },
  "0145": {
    "context": "000BAAF4",
    "developer_comment": "03/05/2021 16:22",
    "character_limit": 9,
    "string": "2021/03/05 16:22"
  },
  "0146": {
    "context": "000BAA78",
    "developer_comment": "A memory of back when Nagisa was still alive. On that day, she asks her older sister Kazami to buy a certain something...",
    "character_limit": 61,
    "string": "まだ凪沙が生きていた頃の記憶。風見はその日、凪沙にせがまれて、とあるものを買っていた……。"
  },
  "0147": {
    "context": "000BAA64",
    "developer_comment": "06/01/2027 14:50",
    "character_limit": 9,
    "string": "2027/06/01 14:50"
  },
  "0148": {
    "context": "000BA9F0",
    "developer_comment": "Two months after Kazami enlisted in Sirius. Watase questions Kazami on why she was wearing a certain something...",
    "character_limit": 57,
    "string": "風見がシリウスに入って２ヶ月目。風見は肌身は出さずつけていた品を、渡瀬に見咎められた……。"
  },
  "0149": {
    "context": "000BA9DC",
    "developer_comment": "09/07/2030 09:05",
    "character_limit": 9,
    "string": "2030/09/07 09:05"
  },
  "0150": {
    "context": "000BA960",
    "developer_comment": "About a week ago. Kazami receives an e-mail from a junior fire inspector about the incident entwined so deeply with her...",
    "character_limit": 61,
    "string": "約１週間前の事。風見は後輩の火災調査員から、因縁深いあの事故に関するメールを受け取った……。"
  },
  "0151": {
    "context": "000BA948",
    "developer_comment": "09/12/2027 14:55",
    "character_limit": 11,
    "string": "2027/09/12 14:55"
  },
  "0152": {
    "context": "000BA8C0",
    "developer_comment": "Half a year after Kazami enlisted in Sirius, she finds herself anguishing alone after attending a classical music concert with Watase.",
    "character_limit": 67,
    "string": "シリウスに入り、約半年が過ぎたある日。前日に渡瀬とクラシックのコンサートを鑑賞した風見は、独り苦悶していた……。"
  },
  "0153": {
    "context": "000BA8A8",
    "developer_comment": "08/15/2020 13:35",
    "character_limit": 11,
    "string": "2020/08/15 13:35"
  },
  "0154": {
    "context": "000BA830",
    "developer_comment": "The summer Natsuhiko met Yuuri, they embark on a journey to find the truth behind the \"Seven Wonders of Rokumei City\".",
    "character_limit": 59,
    "string": "遠い日の思い出。夏彦が悠里と出会ってから初めての夏休み。夏彦たちは『鹿鳴市の七不思議』の謎を解明しようとしていた。"
  },
  "0155": {
    "context": "000BA818",
    "developer_comment": "10/05/2020 15:26",
    "character_limit": 11,
    "string": "2020/10/05 15:26"
  },
  "0156": {
    "context": "000BA7B8",
    "developer_comment": "A day one year after Natsuhiko's father died. Natsuhiko hears stories of him from his mother.",
    "character_limit": 47,
    "string": "夏彦の父が死んでから１年が過ぎた\nある日。夏彦は母から、亡き父の思い出話を聞くことになった。"
  },
  "0157": {
    "context": "000BA7A4",
    "developer_comment": "05/11/2030 16:10",
    "character_limit": 9,
    "string": "2030/05/11 16:10"
  },
  "0158": {
    "context": "000BA730",
    "developer_comment": "Natsuhiko had just advanced to high school. Mashiro starts coming to his house to cook his meals for him each day.",
    "character_limit": 57,
    "string": "夏彦が鹿鳴学園に進学したばかりの頃。日々の食事に困っていた夏彦の元に、ましろが手料理を作りに通ってくる事になった。"
  },
  "0159": {
    "context": "000BA71C",
    "developer_comment": "09/13/2030 18:50",
    "character_limit": 9,
    "string": "2030/09/13 18:50"
  },
  "0160": {
    "context": "000BA698",
    "developer_comment": "After a fight with Mashiro over the existence of terrorists in town, Natsuhiko shared an irrational, yet warm memory with Salyu.",
    "character_limit": 65,
    "string": "夏彦とましろがテロの真偽で揉めてケンカ別れした夜。夏彦にはサリュとの間に繰り広げられた不条理で暖かな記憶があった。"
  },
  "0161": {
    "context": "000BA680",
    "developer_comment": "--/--/---- --:--",
    "character_limit": 11,
    "string": "----/--/-- --:--"
  },
  "0162": {
    "context": "000BA610",
    "developer_comment": "At a place out of time. At a time out of place.\n\"You\" watch memories of nine.\nAnd meet \"her\" face to face.",
    "character_limit": 55,
    "string": "どこにもない時間。どこにもない空間。\n“君”は９人の記憶を巡る旅の果てに、\n“彼女”と出会った。"
  },
  "0163": {
    "context": "000BA5FC",
    "developer_comment": "03/30/2021 11:38",
    "character_limit": 9,
    "string": "2021/03/30 11:38"
  },
  "0164": {
    "context": "000BA580",
    "developer_comment": "Eleven years ago. Jun ran from home after a fight with her father. She then gets a warm greeting from none other than...",
    "character_limit": 61,
    "string": "１１歳の時の記憶。洵は父とケンカをして家を飛び出した。そんな彼女を、温かく迎えてくれたのは……。"
  },
  "0165": {
    "context": "000BA56C",
    "developer_comment": "04/07/2021 13:12",
    "character_limit": 9,
    "string": "2021/04/07 13:12"
  },
  "0166": {
    "context": "000BA4F0",
    "developer_comment": "Jun and Nagisa buy a present for Kazami. But later that day, an incident would cause Jun's fate to spiral out of control...",
    "character_limit": 61,
    "string": "凪沙と共に、風見へのプレゼントを買いにいった洵。その日、洵の運命を覆す事故が起きた……。"
  },
  "0167": {
    "context": "000BA4D8",
    "developer_comment": "04/08/2021 14:45",
    "character_limit": 11,
    "string": "2021/04/08 14:45"
  },
  "0168": {
    "context": "000BA458",
    "developer_comment": "Kazami lost her mental stability after her sister's death. \"How can I support Kazami?\" Jun desperately wonders what to do...",
    "character_limit": 63,
    "string": "妹の死を境に、風見は心の平静を失った。どうすれば風見を支えられるのか？　洵は自分に何ができるか必死で考えた……。"
  },
  "0169": {
    "context": "000BA3E0",
    "developer_comment": "After endless effort, Jun finally becomes a rescue worker. But then the fateful day came on September 16, 2030...",
    "character_limit": 59,
    "string": "途方もない努力の果てに、洵は晴れてレスキュー隊に配属された。そして２０３０年９月１６日。運命の日が訪れた……。"
  },
  "0170": {
    "context": "000BA3C8",
    "developer_comment": "09/05/2027 12:23",
    "character_limit": 11,
    "string": "2027/09/05 12:23"
  },
  "0171": {
    "context": "000BA348",
    "developer_comment": "Three years ago, when Jun was in high school, she'd hang out with Kazami. But one day, Jun notices something off about her...",
    "character_limit": 63,
    "string": "約３年前。洵が高校生だった頃。洵は風見と一緒に、街に遊びに出て来ていた。だが風見の様子がおかしいと気付き……。"
  },
  "0172": {
    "context": "000BA330",
    "developer_comment": "08/01/2030 07:48",
    "character_limit": 11,
    "string": "2030/08/01 07:48"
  },
  "0173": {
    "context": "000BA2B8",
    "developer_comment": "Jun's first day of work as a rescue worker. She meets a man with a sour face and harsh tongue at the fire department...",
    "character_limit": 59,
    "string": "レスキュー隊への配属が決まった、その出勤初日。洵が消防署内で出会ったのは、目つきも口も悪い男だった……。"
  },
  "0174": {
    "context": "000BA2A4",
    "developer_comment": "09/13/2030 11:54",
    "character_limit": 9,
    "string": "2030/09/13 11:54"
  },
  "0175": {
    "context": "000BA220",
    "developer_comment": "Three days ago, when Jun was providing local disaster prevention guidance, she had a surprise encounter with some familiar faces...",
    "character_limit": 65,
    "string": "３日前。防災指導のため、各公共施設を回っていた時の事。洵はある施設で、意外な人物を見かけていた……。"
  },
  "0176": {
    "context": "000BA20C",
    "developer_comment": "09/15/2030 12:18",
    "character_limit": 9,
    "string": "2030/09/15 12:18"
  },
  "0177": {
    "context": "000BA188",
    "developer_comment": "Explosions and fires plague the PRC. Unable to accept her captain's orders, Jun tries rushing into the building all by herself...",
    "character_limit": 65,
    "string": "爆発と火災に見舞われた超心研。隊長の命令に納得できなかった洵は、その現場にたった１人で飛び込もうとした……。"
  },
  "0178": {
    "context": "000BA170",
    "developer_comment": "07/07/2021 16:25",
    "character_limit": 11,
    "string": "2021/07/07 16:25"
  },
  "0179": {
    "context": "000BA0F0",
    "developer_comment": "Nine years ago, Natsuhiko and Yuuri got caught up in the LABO incident. Dr. Tenkawa saves them with only moments to spare...",
    "character_limit": 63,
    "string": "９年前。夏彦と共にラボの事故に巻き込まれたあの日。間一髪のところで、２人は天川博士に救われる……。"
  },
  "0180": {
    "context": "000BA0D8",
    "developer_comment": "07/08/2021 22:16",
    "character_limit": 11,
    "string": "2021/07/08 22:16"
  },
  "0181": {
    "context": "000BA050",
    "developer_comment": "After Yuuri receives an examination and is discovered to have gone through some great changes, she is forced into a certain choice...",
    "character_limit": 67,
    "string": "検査を受けた後。身体に重大な変化が見つかった悠里は、ある選択を迫られる事になる……。"
  },
  "0182": {
    "context": "000BA03C",
    "developer_comment": "07/12/2021 09:05",
    "character_limit": 9,
    "string": "2021/07/12 09:05"
  },
  "0183": {
    "context": "000B9FB0",
    "developer_comment": "Yuuri's days of experimentation at LABO began. She is taught how BC particles relate to the brain and gradually, her BC ability grows...",
    "character_limit": 69,
    "string": "ラボでの実験の日々。明らかになるＢＣ粒子と脳の関係。その中で悠里のＢＣ能力は着実に高められて行った……。"
  },
  "0184": {
    "context": "000B9F98",
    "developer_comment": "10/06/2021 09:12",
    "character_limit": 11,
    "string": "2021/10/06 09:12"
  },
  "0185": {
    "context": "000B9F10",
    "developer_comment": "One day three months after coming to LABO. Yuuri learns about the true intention behind the repeated experiments from Dr. Tenkawa...",
    "character_limit": 67,
    "string": "ラボに来てから３ヶ月経ったある日。悠里は天川博士から、実験を繰り返してきた真意を告げられた……。"
  },
  "0186": {
    "context": "000B9EFC",
    "developer_comment": "10/06/2021 21:06",
    "character_limit": 9,
    "string": "2021/10/06 21:06"
  },
  "0187": {
    "context": "000B9E78",
    "developer_comment": "Yuuri was determined to erase herself from Natsuhiko's mind. But as she erases his memories, her own emotions start to overflow...",
    "character_limit": 65,
    "string": "悠里は夏彦の中から、自分を消そうと決意した。だが夏彦の記憶を消すうちに、悠里の中にある想いがあふれ出し……。"
  },
  "0188": {
    "context": "000B9E64",
    "developer_comment": "07/07/2030 21:17",
    "character_limit": 9,
    "string": "2030/07/07 21:17"
  },
  "0189": {
    "context": "000B9DD8",
    "developer_comment": "Two months ago, Yuuri's ninth encounter with Natsuhiko since the incident. Yuuri notices the feelings her best friend has kept hidden...",
    "character_limit": 69,
    "string": "今から２ヶ月前、夏彦との９度目の逢瀬を迎えたその日。悠里は、親友の秘める想いに気付いてしまった……。"
  },
  "0190": {
    "context": "000B9DC0",
    "developer_comment": "09/16/2030 06:10",
    "character_limit": 11,
    "string": "2030/09/16 06:10"
  },
  "0191": {
    "context": "000B9D40",
    "developer_comment": "The fateful day arrives. Fires and explosions rage throughout LABO as Yuuri begins working to save Natsuhiko and his friends...",
    "character_limit": 63,
    "string": "そして運命の日。ラボ内が爆発と火災に見舞われる中、悠里は夏彦たちを救うため行動を開始した……。"
  },
  "0192": {
    "context": "000B9D28",
    "developer_comment": "09/16/2030 06:29",
    "character_limit": 11,
    "string": "2030/09/16 06:29"
  },
  "0193": {
    "context": "000B9CB0",
    "developer_comment": "\"Restart Natsuhiko's stopped time\"\n--Yuuri thought her efforts to accomplish that feat were going well, but then...",
    "character_limit": 59,
    "string": "『９年前に停止した夏彦の時間を、再び動かす』――悠里のその試みは、全て順調に行ったかに思えたが……。"
  },
  "0194": {
    "context": "000B9C98",
    "developer_comment": "09/16/2030 09:00",
    "character_limit": 11,
    "string": "2030/09/16 09:00"
  },
  "0195": {
    "context": "000B9C10",
    "developer_comment": "Yuuri woke up in a world of smoke and flame... She ran around, driven by the desire to live. She then once again encounters \"him\"...",
    "character_limit": 67,
    "string": "目覚めると、そこは火と焦熱の世界……。死にたくない。そう思い、逃げたその場所で、悠里は彼と再会した……。"
  },
  "0196": {
    "context": "000B9BF8",
    "developer_comment": "05/29/2020 17:09",
    "character_limit": 11,
    "string": "2020/05/29 17:09"
  },
  "0197": {
    "context": "000B9B70",
    "developer_comment": "A few days after Yuuri ran away from home with Natsuhiko. At the park, she learns of the emotions imbued within Natsuhiko's watch...",
    "character_limit": 67,
    "string": "夏彦と共に家出をした数日後。悠里は公園で、夏彦の腕時計に込められた想いを知った……。"
  },
  "0198": {
    "context": "000B9B58",
    "developer_comment": "08/01/2020 12:30",
    "character_limit": 11,
    "string": "2020/08/01 12:30"
  },
  "0199": {
    "context": "000B9AD0",
    "developer_comment": "The first summer break Yuuri spent with Natsuhiko and Mashiro. To end their constant bickering and reconcile their differences, she...",
    "character_limit": 67,
    "string": "夏彦やましろと過ごした最初の夏休み。ケンカの耐えなかった２人を仲直りさせるため、悠里が考えた方法は……。"
  },
  "0200": {
    "context": "000B9AB8",
    "developer_comment": "09/15/2030 20:15",
    "character_limit": 11,
    "string": "2030/09/15 20:15"
  },
  "0201": {
    "context": "000B9A40",
    "developer_comment": "A day before the incident. Yuuri receives a lecture from Dr. Tenkawa about the experiment to take place the next day...",
    "character_limit": 59,
    "string": "事件発生の前日。悠里は天川博士から\n『９月１６日の実験』についてレクチャーを受けていた……。"
  },
  "0202": {
    "context": "000B9A2C",
    "developer_comment": "07/07/2029 22:47",
    "character_limit": 9,
    "string": "2029/07/07 22:47"
  },
  "0203": {
    "context": "000B99D0",
    "developer_comment": "Tanabata, one year ago. Yuuri's thoughts turn to the other her within Natsuhiko's mind...",
    "character_limit": 45,
    "string": "今から１年前の七夕の日。悠里は夏彦の中にいる、もう１人の自分について想いを巡らせた……。"
  }
}
